{"adapter_version":"0.1.0","annotations_json_sha256":"4ffc8e0969c22c61501ed0794c5e025203fe89f3932b9bdf12cebe2ac2166439","counts":{"errors":0,"exported":2,"input":2,"skipped":0,"warnings":0},"findings":[],"input_snapshot_digest":"249cbf286bf3cf54479291ca8b2bcc20db70c68c4d1073d0b4c0a0afb7edde6c","pack_id":"urn:uuid:94da560b-3600-5820-adb6-070fd907f32a","package_sha256":"4dba6f51c87ae309be6eeb15059cb395e66a796feb0c8f995fab64c9f98892b3","producer":"urn:uuid:da94868b-ce7f-56d6-9c77-c5b959f15f5a","schema_version":"annotation-pack-validation-report/0.1","semantic_digest":"f7dac5e98d6cf0743122950ea4e2f27bf5fab67175e22889d10cef63e0c476e2","status":"valid","validator_version":"0.1.0"}
